{
  "$schema": "./profile.schema.json",
  "profile": {
    "name": "Ecclesiates Natarios Sihombing",
    "username": "ecclesyia",
    "headline": "CS - SE Student & HIMTI Activist",
    "affiliation": "BINUS University",
    "location": "Bekasi, Indonesia",
    "status": "College Student / Activist Responsi",
    "about": [
      "I am a Computer Science student at BINUS University specializing in Software Engineering.",
      "I work as a HIMTI Responsi Activist, helping fellow students learn the fundamental in college."
    ],
    "totalRepos": 25
  },
  "research": {
    "primary": "Software Architecture",
    "direction": "Architecture, programming & design",
    "themes": "Algorithms / Software Development",
    "narrative": "I am currently focusing on exploring whatever captures my interest, whether it is programming, mathematics, data science, or mechanics. Deepening my understanding of these fields is a fundamental part of satisfying my curiosity and learning journey."
  },
  "focus": [
    {
      "name": "Software Engineering",
      "description": "Designing, developing, testing, and maintaining clean and robust software systems."
    },
    {
      "name": "Full Stack Developer",
      "description": "Building responsive web applications, interactive frontends, and reliable backend APIs."
    },
    {
      "name": "Game Development",
      "description": "Exploring game engines, mechanics, physics, and scripting workflows (e.g. GDScript in Godot)."
    },
    {
      "name": "Passionate Projects",
      "description": "Creating tools, bots, and fun open-source applications that solve real needs (e.g., Discord bots)."
    }
  ],
  "projects": [
    {
      "name": "portofolio",
      "url": "https://github.com/ecclesyia/portofolio",
      "homepage": "https://ecclesyia.netlify.app",
      "focus": "Portfolio Site",
      "summary": "A website of tracking and as a portfolio for me and sharing the thing that I had made in the past.",
      "heroLabel": "JS / CSS / HTML build"
    },
    {
      "name": "ecclesyia",
      "url": "https://github.com/ecclesyia/ecclesyia",
      "homepage": "",
      "focus": "Profile Config",
      "summary": "Dynamic, terminal-style profile README configurations.",
      "heroLabel": "Profile build"
    }
  ],
  "techStack": [
    "Kotlin",
    "Java",
    "JavaScript",
    "Python",
    "SQL",
    "GDScript"
  ],
  "links": [
    {
      "label": "GitHub",
      "value": "ecclesyia",
      "url": "https://github.com/ecclesyia",
      "logo": "github",
      "color": "0B1220"
    }
  ],
  "activity": {
    "enabled": false,
    "limit": 6
  },
  "appearance": {
    "palette": "mono"
  },
  "footer": "Dying is easy, young man. Living is harder."
}